{
  "CasualtyID": "01KPVR79AJJQEDQEHC6ET055PS",
  "type": "pow",
  "description": "Approximately 25,000 German troops from remnants of twenty disorganized divisions captured in the Mons pocket after being encircled by US forces",
  "event_context": {
    "EventID": "01KHXPA7K8M7N4V2QJ3R5T6V8X",
    "Sub-eventID": "01KHXPJ6S7T8V9X0Y1Z2A3B4C5"
  },
  "source": {
    "EventID": "01KHXPA7K8M7N4V2QJ3R5T6V8X",
    "Sub-eventID": "01KHXPJ6S7T8V9X0Y1Z2A3B4C5",
    "book": "Breakout And Pursuit",
    "chapter": "Toward the Heart of Germany",
    "paragraph_number": 32
  }
}
